{
  "$schema": "https://json-schema.org/draft/2020-12/schema",
  "$comment": "Generated by scripts/export_api_schemas.py from apps/api/schemas.py: do not edit",
  "$defs": {
    "ConfirmedObservation": {
      "additionalProperties": false,
      "properties": {
        "item": {
          "enum": [
            "tag_attached",
            "visible_damage",
            "photo_quality"
          ],
          "title": "Item",
          "type": "string"
        },
        "observation": {
          "enum": [
            "yes",
            "no",
            "not_observable"
          ],
          "title": "Observation",
          "type": "string"
        }
      },
      "required": [
        "item",
        "observation"
      ],
      "title": "ConfirmedObservation",
      "type": "object"
    }
  },
  "additionalProperties": false,
  "properties": {
    "inspector": {
      "not": {
        "const": "system"
      },
      "pattern": "^[a-z][a-z0-9._-]{1,31}$",
      "title": "Inspector",
      "type": "string"
    },
    "observations": {
      "items": {
        "$ref": "#/$defs/ConfirmedObservation"
      },
      "title": "Observations",
      "type": "array"
    },
    "apply_compensation": {
      "title": "Apply Compensation",
      "type": "boolean"
    },
    "note": {
      "anyOf": [
        {
          "maxLength": 300,
          "minLength": 1,
          "type": "string"
        },
        {
          "type": "null"
        }
      ],
      "default": null,
      "title": "Note"
    }
  },
  "required": [
    "inspector",
    "observations",
    "apply_compensation"
  ],
  "title": "InspectionConfirmRequest",
  "type": "object"
}
